output/ej1_descriptivo.csv

,count,mean,std,min,25%,50%,75%,max,median,var,mode,skewness,kurtosis
Unnamed: 0,53940.0,26970.5,15571.281096942537,1.0,13485.75,26970.5,40455.25,53940.0,26970.5,242464795.0,1.0,7.857061651334269e-17,-1.1999999999999997
carat,53940.0,0.7979397478680015,0.47401124440541836,0.2,0.4,0.7,1.04,5.01,0.7,0.22468665982277328,0.3,1.1166459208126125,1.2566353326079285
depth,53940.0,61.74940489432702,1.4326213188336607,43.0,61.0,61.8,62.5,79.0,61.8,2.0524038431766973,62.0,-0.0822940263018649,5.739414582329394
table,53940.0,57.45718390804598,2.234490562821323,43.0,56.0,57.0,59.0,95.0,57.0,4.992948075337552,56.0,0.7968958486695424,2.801856860032036
price,53940.0,3932.799721913237,3989.439738146379,326.0,950.0,2401.0,5324.25,18823.0,2401.0,15915629.42430145,605.0,1.618395283383529,2.17769575924869
x,53940.0,5.731157211716722,1.1217607467924928,0.0,4.71,5.7,6.54,10.74,5.7,1.258347173044451,4.37,0.3786763426463926,-0.6181606709137237
y,53940.0,5.734525954764553,1.1421346741235554,0.0,4.72,5.71,6.54,58.9,5.71,1.30447161383532,4.34,2.434166716488555,91.21455715880997
z,53940.0,3.538733778272154,0.7056988469499942,0.0,2.91,3.53,4.04,31.8,3.53,0.49801086258655125,2.7,1.5224225590685603,47.08661932511808

Respuestas.md

## Ejercicio 1 — Análisis Estadístico Descriptivo

> | column | skewness | kurtosis | nº outliers |                                                                                                                                             |
> | :----: | :------: | :------: | :---------: | :------------------------------------------------------------------------------------------------------------------------------------------ |
> | carat  |   1.12   |   1.26   |    1889     | Distribución es leptocúrtica (kurtosis > 0) muy sesgada a la derecha (skewness > 1)                                                         |
> | depth  |  -0.08   |   5.74   |    2545     | Distribución es leptocúrtica (kurtosis > 0) bastante simétrica (skewness ≈ 0)                                                               |
> | table  |   0.8    |   2.8    |     605     | Distribución es leptocúrtica (kurtosis > 0) moderadamente sesgada a la derecha (skewness entre 0.5 y 1)                                     |
> | price  |   1.62   |   2.18   |    3540     | Distribución es leptocúrtica (kurtosis > 0) muy sesgada a la derecha (skewness > 1)                                                         |
> |   x    |   0.38   |  -0.62   |     32      | Distribución es prácticamente normal pero con tendencia aplanada (kurtosis ≈/< 0) sesgada ligeramente a la derecha (skewness entre 0 y 0.5) |
> |   y    |   2.43   |  91.21   |     29      | Distribución es fuertemente leptocúrtica (kurtosis > 0) fuertemente sesgada a la derecha (skewness > 1)                                     |
> |   z    |   1.52   |  47.09   |     49      | Distribución es fuertemente leptocúrtica (kurtosis > 0) muy sesgada a la derecha (skewness > 1)                                             |
>
> Durante el análisis de los outliers se han detectado registros iguales a 0 en los campos `x`, `y` y `z`, que representan las dimensiones del diamante.
> No considero que estos valores como outliers válidos, sino errores de registro, ya que son mediciones incompatibles con el peso (`carat`) registrado, que resulta físicamente imposible.
>
> En consecuencia, he decidido eliminar estas filas del dataset para limpiar y mejorar la calidad de los datos y del análisis.

## Ejercicio 2 — Inferencia con Scikit-Learn

> ### 2.1 Preprocesamiento
>
> Tras preparar el dataframe reutilizando código del ejercicio 1, he implementado el prepocesamiento donde primeramente se ha eliminado la columna `Unnamed` puesto que no aporta informacion relevante (row id) y las variables `x`, `y` y `z` puesto que muestran una clara multicolinealidad (|r| > 0.9) entre ellas y con el campo `carat`. De lo contrario el modelo puede confundirse ya que no entiende puesto que no es clara la variable responsable de la predicción resultando en un modelo más inestable y con mayor varianza.
>
> A conttinuación se han codificado los valores de las variables categoricas mediante _One-Hot Encoding_ (`pd.get_dummies()`).
>
> Una vez preparado el dataframe se distinguen las variables predictivas (`X`) de la variable objetivo (`y`). Luego dividir aleatoriamente (`seed 42`) sus datos en proporcion 80%-20%. El 80% de los datos serán usados para entrenamiento mientras que el 20% restante se reserva para el test del modelo predictivo.
>
> Finalmente se aplica un escalado (`StandardScaler`) ajustado únicamente sobre los datos de entrenamiento para respetar que "se desconocen" los datos de test. Luego se aplica el escalado sobre los datos de test para mantenerlos en la misma escala.
>
> Las variables resultantes son `X_train`, `X_test`, `y_train` y `y_test`.
>
> ### 2.2 Modelo A — Regresión Lineal (LinearRegression)
>
> Tras generar el grafico de residuos es notable un patron de residuos "enfermos" con una distribucíón en forma de "U". Y aunque R² mostraba un valor muy alto, los errores también eran elevados lo que era una clara señal de que el modelo no estaba funcioncionando correctamente.
>
> La solución implementada ha sido aplicar una escala logarítmica sobre la variable `price`. Con esto se ha conseguido mejorar la linealidad de las relaciones con la variable objetivo, mantener un R² cercano a 1, reducir drasticamente los errores MAE y RMSE y graficar una dsitribución de residuos más lineal.
>
> En cuanto a las variables más influyentes destaca considerablemente la variable `carat` con un coeficiente de 1.04 frente al segunda variable `clarity_VS2` (codificacion del campo `clarity`) con un coeficiente de 0.35 que no es demasiado significativo.
>
> ![ej2_residuos.png](/output/ej2_residuos.png)
>
> El análisis más útil del Ejercicio 1 ha sido el _heatmap_ de correlaciones, ya que me permitió identificar la fuerte relación entre `carat` y `price`, posteriormente confirmada en el modelo de regresión. También fue clave para detectar multicolinealidad entre `carat` y las dimensiones (`x`, `y`, `z`) y mejorar el modelo simplificando el grupo de variables predictoras. Además, el análisis de las distribuciones en los histogrmas ayudó a detectar la solución sobre la transformación logarítmica de la variable objetivo para el correcto funcionamiento del modelo.